{
    "composition": "polyimide",
    "name": "Kapton HN",
    "manufacturerInfo": {
        "name": "DuPont"
    },
    "thermalConductivity": 0.2,
    "dielectricStrength": [
        {
            "value": 303000000.0,
            "thickness": 2.5e-05,
            "humidity": 0.5
        },
        {
            "value": 240000000.0,
            "thickness": 5e-05,
            "humidity": 0.5
        },
        {
            "value": 205000000.0,
            "thickness": 7.5e-05,
            "humidity": 0.5
        },
        {
            "value": 154000000.0,
            "thickness": 0.000125,
            "humidity": 0.5
        },
        {
            "value": 339000000.0,
            "thickness": 2.5e-05,
            "humidity": 0
        },
        {
            "value": 315000000.0,
            "thickness": 2.5e-05,
            "humidity": 0.3
        },
        {
            "value": 280000000.0,
            "thickness": 2.5e-05,
            "humidity": 0.8
        },
        {
            "value": 268000000.0,
            "thickness": 2.5e-05,
            "humidity": 1
        }
    ]
}
